{
  "type": "object",
  "properties": {
    "id": {
      "type": "string",
      "minLength": 1,
      "pattern": "\\S"
    },
    "workflow_id": {
      "type": "string",
      "minLength": 1,
      "pattern": "\\S"
    },
    "human_owner": {
      "type": "string",
      "minLength": 1,
      "pattern": "\\S"
    },
    "sources": {
      "type": "array",
      "items": {
        "type": "object",
        "properties": {
          "id": {
            "type": "string",
            "minLength": 1,
            "pattern": "\\S"
          },
          "source_of_truth": {
            "type": "string",
            "minLength": 1,
            "pattern": "\\S"
          },
          "purpose": {
            "type": "string",
            "minLength": 1,
            "pattern": "\\S"
          },
          "classification": {
            "enum": [
              "public",
              "internal",
              "confidential",
              "restricted"
            ]
          },
          "fields": {
            "type": "array",
            "items": {
              "type": "string",
              "minLength": 1,
              "pattern": "\\S"
            },
            "minItems": 1,
            "uniqueItems": true
          },
          "access": {
            "enum": [
              "read",
              "write",
              "read_write"
            ]
          },
          "allowed_recipients": {
            "type": "array",
            "items": {
              "type": "string",
              "minLength": 1,
              "pattern": "\\S"
            },
            "minItems": 0,
            "uniqueItems": true
          },
          "retention_days": {
            "type": "integer",
            "minimum": 0
          },
          "training_allowed": {
            "type": "boolean"
          },
          "terms_reference": {
            "type": "string",
            "minLength": 1,
            "pattern": "\\S"
          },
          "dispute_owner": {
            "type": "string",
            "minLength": 1,
            "pattern": "\\S"
          }
        },
        "required": [
          "id",
          "source_of_truth",
          "purpose",
          "classification",
          "fields",
          "access",
          "allowed_recipients",
          "retention_days",
          "training_allowed",
          "terms_reference",
          "dispute_owner"
        ],
        "additionalProperties": false
      },
      "minItems": 1,
      "uniqueItems": true
    }
  },
  "required": [
    "id",
    "workflow_id",
    "human_owner",
    "sources"
  ],
  "additionalProperties": false,
  "$schema": "https://json-schema.org/draft/2020-12/schema",
  "title": "data-access"
}
